{
  "schemaVersion": 1,
  "profileId": "40cb4ea8-4774-4cd1-9d29-5d305412d49e",
  "revision": 1,
  "endpointRole": "speakers",
  "listeningMode": "upmix",
  "sourcePolicy": "autoDeclaredLayout",
  "routing": {
    "upmix": { "centerGainDb": -3, "surroundGainDb": -6,
      "deriveLfe": true, "lfeGainDb": -6, "lfeLowPassHz": 120 }
  },
  "output": {
    "masterGainDb": 0,
    "channelGainDb": [0,0,0,0,0,0,0,0],
    "channelDelayMs": [0,0,0,0,0,0,0,0],
    "channelMute": [false,false,false,false,false,false,false,false],
    "bassManagement": { "enabled": false, "crossoverHz": 80,
      "highPassSatellites": true, "sumToLfe": true, "sumToLfeGainDb": 0 },
    "limiter": { "enabled": true, "ceilingDb": -0.3, "releaseMs": 80 }
  }
}
